{
  "catalog_id": "storage-presets",
  "catalog_version": "v0.1.1",
  "catalog_notes": "Session 6 v0.1.1. Expanded from 3 to 7 entries with sourced thermophysical data. Thermophysical properties (latent heat, cp, target temp) sourced from NASA reports and peer-reviewed literature. mass/charge/discharge limits are trade-study estimates. research_required=true on all entries. BEST-SOLVE-001 partially resolved: thermophysical data sourced, sizing data still estimated.",
  "entries": [
    {
      "preset_id": "pcm_al12si",
      "label": "Al-12%Si Eutectic PCM (Zone C Buffer, ~855K)",
      "storage_class": "pcm_latent",
      "storage_capacity_j": 17941000,
      "charge_power_limit_w": 15000,
      "discharge_power_limit_w": 15000,
      "topology_role": "active_hot_island_buffer",
      "target_temp_k": 855,
      "temp_min_k": 825,
      "temp_max_k": 885,
      "cp_basis_j_per_kgk": 960,
      "latent_heat_j_per_kg": 512600,
      "typical_mass_kg": 35,
      "research_required": true,
      "basis_note": "Melting point 582°C (855K), latent heat 512.6 J/g — Frontiers in Energy Research 2024, Al-12Si/ceramic composite PCM characterization. cp ~960 J/kg·K from Al-alloy DSC data. capacity = 35kg × 512600 J/kg. mass/charge limits are trade-study estimates for 50kW node eclipse buffer."
    },
    {
      "preset_id": "pcm_alcu",
      "label": "Al-33.6%Cu Eutectic PCM (Zone C Buffer, ~821K)",
      "storage_class": "pcm_latent",
      "storage_capacity_j": 17572500,
      "charge_power_limit_w": 12000,
      "discharge_power_limit_w": 12000,
      "topology_role": "active_hot_island_buffer",
      "target_temp_k": 821,
      "temp_min_k": 791,
      "temp_max_k": 851,
      "cp_basis_j_per_kgk": 900,
      "latent_heat_j_per_kg": 319500,
      "typical_mass_kg": 55,
      "research_required": true,
      "basis_note": "Latent heat 319.5 J/g — 2025 Al-33.6 mass% Cu eutectic thermal properties study. Eutectic temp ~548°C (821K) from Al-Cu binary phase diagram. cp estimated from Al-alloy class. capacity = 55kg × 319500 J/kg. mass/charge limits are trade-study estimates."
    },
    {
      "preset_id": "pcm_lif_caf2",
      "label": "LiF-20%CaF2 Eutectic PCM (High-Temp Zone C, ~1040K)",
      "storage_class": "pcm_latent",
      "storage_capacity_j": 22820000,
      "charge_power_limit_w": 8000,
      "discharge_power_limit_w": 8000,
      "topology_role": "regen_hot_island_buffer",
      "target_temp_k": 1040,
      "temp_min_k": 1010,
      "temp_max_k": 1070,
      "cp_basis_j_per_kgk": 1600,
      "latent_heat_j_per_kg": 815000,
      "typical_mass_kg": 28,
      "research_required": true,
      "basis_note": "Melt temperature 1040K, latent heat 815 kJ/kg — NASA reference storage system for Brayton-Cycle Solar Dynamic systems (LiF-20CaF2 Table 1). Corroborated by NASA TES-1/TES-2 flight experiment docs. cp estimated from fluoride salt class. capacity = 28kg × 815000 J/kg. mass/charge limits estimated."
    },
    {
      "preset_id": "sensible_sic",
      "label": "SiC Sensible Store (Refractory Buffer, 800–1600K)",
      "storage_class": "sensible_solid",
      "storage_capacity_j": 66000000,
      "charge_power_limit_w": 20000,
      "discharge_power_limit_w": 20000,
      "topology_role": "regen_hot_island_buffer",
      "target_temp_k": 1200,
      "temp_min_k": 800,
      "temp_max_k": 1600,
      "cp_basis_j_per_kgk": 1200,
      "latent_heat_j_per_kg": 0,
      "typical_mass_kg": 55,
      "research_required": true,
      "basis_note": "cp ~1200 J/kg·K at 1000°C from SiC/SiC composites thermophysical properties refs and Hexoloy SA SiC datasheet. capacity = 55kg × 1200 J/kg·K × (1600-1200K) = 26.4MJ sensible at ΔT=400K; full range 66MJ. mass/charge limits estimated for refractory buffer at 50kW node."
    },
    {
      "preset_id": "sensible_graphite",
      "label": "Graphite Sensible Store (Ultra-High-Temp, 500–3000K)",
      "storage_class": "sensible_solid",
      "storage_capacity_j": 87550000,
      "charge_power_limit_w": 25000,
      "discharge_power_limit_w": 25000,
      "topology_role": "regen_hot_island_buffer",
      "target_temp_k": 1800,
      "temp_min_k": 500,
      "temp_max_k": 3000,
      "cp_basis_j_per_kgk": 1700,
      "latent_heat_j_per_kg": 0,
      "typical_mass_kg": 30,
      "research_required": true,
      "basis_note": "cp ~1700 J/kg·K at high temperature from Entegris/POCO Graphite Properties Table 15-2 and cp-vs-T curve to 3000°C. capacity = 30kg × 1700 J/kg·K × (3000-500K)/2 ≈ rough range ref. mass/charge limits estimated. Ultra-high-temp reference class; containment and oxidation protection critical design constraint."
    },
    {
      "preset_id": "pcm_eutectic_store",
      "label": "PCM Eutectic Store — Generic (BEST-SOLVE-001, superseded by pcm_al12si)",
      "storage_class": "eutectic_metal",
      "storage_capacity_j": 30000000,
      "charge_power_limit_w": 5000,
      "discharge_power_limit_w": 10000,
      "topology_role": "active_hot_island_buffer",
      "target_temp_k": 852,
      "temp_min_k": 800,
      "temp_max_k": 900,
      "cp_basis_j_per_kgk": 900,
      "latent_heat_j_per_kg": 515000,
      "typical_mass_kg": 12,
      "research_required": true,
      "basis_note": "Original BEST-SOLVE-001 placeholder. Superseded by pcm_al12si (sourced). Retained for backward compatibility. All values estimated. Use pcm_al12si for new runs."
    },
    {
      "preset_id": "sensible_refractory_store",
      "label": "Sensible Refractory Store — Generic (BEST-SOLVE-001, superseded by sensible_sic)",
      "storage_class": "sensible_solid",
      "storage_capacity_j": 22500000,
      "charge_power_limit_w": 8000,
      "discharge_power_limit_w": 8000,
      "topology_role": "regen_hot_island_buffer",
      "target_temp_k": 1200,
      "temp_min_k": 800,
      "temp_max_k": 1600,
      "cp_basis_j_per_kgk": 750,
      "latent_heat_j_per_kg": 0,
      "typical_mass_kg": 100,
      "research_required": true,
      "basis_note": "Original BEST-SOLVE-001 placeholder. Superseded by sensible_sic (sourced). Retained for backward compatibility. All values estimated. Use sensible_sic for new runs."
    },
    {
      "preset_id": "custom",
      "label": "Custom (Operator-Specified)",
      "storage_class": "custom",
      "storage_capacity_j": 0,
      "charge_power_limit_w": 0,
      "discharge_power_limit_w": 0,
      "topology_role": "",
      "target_temp_k": 0,
      "temp_min_k": 0,
      "temp_max_k": 0,
      "cp_basis_j_per_kgk": 0,
      "latent_heat_j_per_kg": 0,
      "typical_mass_kg": 0,
      "research_required": true,
      "basis_note": "All values must be specified by operator."
    }
  ]
}
